{
    "$schema": "./schemas/versions.schema.json",
    "schema_version": 1,
    "library_version": "1.0.12",
    "updated_at": "2026-10-09T00:00:00Z",
    "sovereign_repo": "camp-candor/995.library",
    "allow_periphery_broadcast": false,
    "shared_pivots": {
        "133.cloudflare": "0.1.4"
    },
    "repositories": {
        "100.agent": {
            "cluster": "00.governance",
            "path": "packages/100.agent",
            "pinned_sha": "7bd4e10a8b9c2d3e4f5a6b7c8d9e0f1a2b3c4d5e",
            "required_contract_version": "0.1.0",
            "expected_branch": "main",
            "status": "LOCKED",
            "dormant_by_design": false,
            "boundary_dependencies": []
        },
        "103.factory": {
            "cluster": "02.simulation",
            "path": "packages/103.factory",
            "pinned_sha": "4f8a120c3d4e5f6a7b8c9d0e1f2a3b4c5d6e7f8a",
            "required_contract_version": "0.1.0",
            "expected_branch": "main",
            "status": "LOCKED",
            "dormant_by_design": false,
            "boundary_dependencies": []
        }
    }
}
